Parsed test spec with 2 sessions

starting permutation: s2_begin s1_begin s1_update_row1 s2_explain s2_commit s1_commit
step s2_begin: BEGIN;
step s1_begin: BEGIN;
step s1_update_row1: UPDATE test_invisible_table_seq_scan SET data = 'updated1' WHERE id = 1;
step s2_explain: EXPLAIN (ANALYZE, INV_ROWS, COSTS OFF, TIMING OFF, SUMMARY OFF) SELECT * FROM test_invisible_table_seq_scan;
QUERY PLAN                                                         
-------------------------------------------------------------------
Seq Scan on test_invisible_table_seq_scan (actual rows=2 loops=1 invisible rows=1)
(1 row)

step s2_commit: COMMIT;
step s1_commit: COMMIT;

starting permutation: s2_begin s1_begin s1_delete_row1 s2_explain s2_commit s1_commit
step s2_begin: BEGIN;
step s1_begin: BEGIN;
step s1_delete_row1: DELETE FROM test_invisible_table_seq_scan WHERE id = 1;
step s2_explain: EXPLAIN (ANALYZE, INV_ROWS, COSTS OFF, TIMING OFF, SUMMARY OFF) SELECT * FROM test_invisible_table_seq_scan;
QUERY PLAN                                                         
-------------------------------------------------------------------
Seq Scan on test_invisible_table_seq_scan (actual rows=2 loops=1 invisible rows=0)
(1 row)

step s2_commit: COMMIT;
step s1_commit: COMMIT;

step s2_commit: COMMIT;
step s1_commit: COMMIT;

starting permutation: s2_begin s1_begin s1_update_row_index s2_explain s2_commit s1_commit
step s2_begin: BEGIN;
step s1_begin: BEGIN;
step s1_update_row_index: UPDATE test_invisible_rows_index_seq_scan SET data = 'updated1' WHERE id = 1;
step s2_explain: EXPLAIN (ANALYZE, INV_ROWS, COSTS OFF, TIMING OFF, SUMMARY OFF) SELECT * FROM test_invisible_rows_index_seq_scan;
QUERY PLAN                                                         
-------------------------------------------------------------------
Seq Scan on test_invisible_rows_index_seq_scan (actual rows=2 loops=1 invisible rows=0)
(1 row)

step s2_commit: COMMIT;
step s1_commit: COMMIT;

step s2_commit: COMMIT;
step s1_commit: COMMIT;

starting permutation: s2_begin s1_begin s1_delete_row_index s2_explain s2_commit s1_commit
step s2_begin: BEGIN;
step s1_begin: BEGIN;
step s1_delete_row_index: DELETE FROM test_invisible_rows_index_seq_scan WHERE id = 1;
step s2_explain: EXPLAIN (ANALYZE, INV_ROWS, COSTS OFF, TIMING OFF, SUMMARY OFF) SELECT * FROM test_invisible_rows_index_seq_scan;
QUERY PLAN                                                         
-------------------------------------------------------------------
Seq Scan on test_invisible_rows_index_seq_scan (actual rows=2 loops=1 invisible rows=0)
(1 row)

step s2_commit: COMMIT;
step s1_commit: COMMIT;
